{
  "profile_id": "ar-core",
  "version": "1.0.0-20260813",
  "locale": "ar",
  "language_evidence_pool": "Arabic only; global formal MSA headwords with separately sourced regional aliases",
  "prose_direction": "rtl",
  "surfaces": {
    "prose": {"direction": "rtl", "numbering_system": "source", "isolation": "Babel/markup; no embedded bidi controls in source"},
    "inline_math": {"direction": "ltr", "numbering_system": "source", "isolation": "one LTR mathematical island"},
    "display_math": {"direction": "ltr", "numbering_system": "source", "isolation": "one LTR mathematical island"},
    "counter": {"direction": "ltr", "numbering_system": "latn", "isolation": "entire dotted counter in one LTR run"},
    "diagram": {"direction": "semantic", "numbering_system": "source", "isolation": "arrows never auto-mirrored; labels isolated independently"},
    "search": {"direction": "semantic", "numbering_system": "source", "isolation": "aliases additive and non-destructive"},
    "speech": {"direction": "rtl", "numbering_system": "source", "isolation": "Arabic-specific spoken-math strings"}
  },
  "orthography": {
    "normalization": "NFC",
    "required": ["Arabic orthographic code points appropriate to MSA"],
    "forbidden": ["Persian ی in Arabic prose", "Persian ک in Arabic prose", "Arabic Presentation Forms in source"],
    "join_controls": "No ZWNJ inheritance from Persian; allow only when independently justified by an Arabic surface."
  },
  "regional_profiles": [
    {"id": "ar-mashriq", "status": "evidence-slot", "digits": "arab candidate", "math_direction": "must be independently evidenced"},
    {"id": "ar-morocco-ltr", "status": "evidence-slot", "digits": "latn candidate", "math_direction": "ltr candidate"},
    {"id": "ar-maghreb-rtl", "status": "evidence-slot", "digits": "undeclared", "math_direction": "rtl candidate; not conflated with Morocco"}
  ],
  "inheritance": {
    "allowed": ["semantic notation IDs", "source TeX and hashes", "RTL/LTR test harnesses", "font and extraction test patterns"],
    "forbidden": ["Persian terminology", "Persian orthography", "Persian digit defaults", "Persian notation evidence", "Persian review status"]
  },
  "qa": [
    "exact source math-token and operand parity",
    "NFC and Arabic/Persian script-leakage checks",
    "all changed pages and dense formula/diagram crops",
    "counter regression at one- and multi-digit components",
    "PDF extraction and accessibility caveats recorded"
  ],
  "review": {"ai_replay": "required independently per admitted unit/release", "human_native": "none at current checkpoint"}
}
