{
  "profile_id": "fa-IR",
  "version": "1.0.0-20260813",
  "locale": "fa-IR",
  "language_evidence_pool": "Iranian Persian only; no Arabic-derived lexical authority",
  "prose_direction": "rtl",
  "surfaces": {
    "prose": {"direction": "rtl", "numbering_system": "source", "isolation": "Babel/markup; meaningful ZWNJ retained in source"},
    "inline_math": {"direction": "ltr", "numbering_system": "source", "isolation": "one LTR mathematical island"},
    "display_math": {"direction": "ltr", "numbering_system": "source", "isolation": "one LTR mathematical island"},
    "counter": {"direction": "ltr", "numbering_system": "latn", "isolation": "entire dotted counter in one LTR run"},
    "diagram": {"direction": "semantic", "numbering_system": "source", "isolation": "arrows never auto-mirrored; labels isolated independently"},
    "search": {"direction": "semantic", "numbering_system": "source", "isolation": "arabext and latn aliases may coexist without rewriting canonical text"},
    "speech": {"direction": "rtl", "numbering_system": "source", "isolation": "Persian-specific spoken-math strings"}
  },
  "orthography": {
    "normalization": "NFC",
    "required": ["Persian ی U+06CC", "Persian ک U+06A9", "meaningful ZWNJ U+200C"],
    "forbidden": ["Arabic ي U+064A in Persian prose", "Arabic ك U+0643 in Persian prose", "Arabic Presentation Forms in source"],
    "join_controls": "ZWNJ is semantically and orthographically significant; extractor loss is an accessibility defect, not permission to remove it."
  },
  "regional_profiles": [
    {"id": "fa-IR-arabext-display", "status": "candidate", "digits": "arabext", "math_direction": "ltr", "activation": "requires corpus evidence and full build/extraction replay"}
  ],
  "inheritance": {
    "allowed": ["semantic notation IDs", "source TeX and hashes", "RTL/LTR test harnesses", "font and extraction test patterns"],
    "forbidden": ["Arabic terminology", "Arabic orthography", "Arabic regional digit defaults", "Arabic notation evidence", "Arabic review status"]
  },
  "qa": [
    "exact source math-token and operand parity",
    "NFC and Arabic/Persian script-leakage checks",
    "ZWNJ preservation in source and explicit extraction-loss accounting",
    "all changed pages and dense formula/diagram crops",
    "counter regression at 1.2 1.10 1.28 and 1.29",
    "PDF extraction and accessibility caveats recorded"
  ],
  "review": {"ai_replay": "required independently per admitted unit/release", "human_native": "none at current checkpoint"}
}
